{
  "$schema": "https://json-schema.org/draft/2020-12/schema",
  "$id": "https://carelens.invalid/contracts/carelens/device-heartbeat.v2.schema.json",
  "title": "device-heartbeat.v2",
  "x-generated-from": "backend/care-monitoring/worker/src/contracts.ts (do not edit by hand)",
  "type": "object",
  "properties": {
    "schema_version": {
      "type": "string",
      "const": "device-heartbeat.v2"
    },
    "device_id": {
      "type": "string",
      "minLength": 1,
      "maxLength": 64,
      "pattern": "^[A-Za-z0-9._:-]+$"
    },
    "clock": {
      "type": "object",
      "properties": {
        "boot_id": {
          "type": "string",
          "minLength": 8,
          "maxLength": 64,
          "pattern": "^[A-Za-z0-9._:-]+$",
          "description": "Random identifier the firmware generates at every boot. All uptime_ms values are relative to this boot."
        },
        "uptime_ms": {
          "type": "integer",
          "minimum": 0,
          "maximum": 1000000000000,
          "description": "Device monotonic clock when this request body was built."
        },
        "wall_clock_synced": {
          "type": "boolean",
          "description": "true only after SNTP synchronisation succeeded in this boot."
        },
        "wall_time": {
          "anyOf": [
            {
              "type": "string",
              "maxLength": 40,
              "pattern": "^\\d{4}-\\d{2}-\\d{2}T\\d{2}:\\d{2}:\\d{2}(\\.\\d{1,9})?(Z|[+-]\\d{2}:\\d{2})$"
            },
            {
              "type": "null"
            }
          ],
          "description": "Device wall clock at uptime_ms when synced; diagnostics only, never used to order evidence."
        }
      },
      "required": [
        "boot_id",
        "uptime_ms",
        "wall_clock_synced",
        "wall_time"
      ],
      "additionalProperties": false,
      "description": "Clock block of every device request. The backend maps uptime to server time per boot (received_at − uptime_ms, minimum over the boot); evidence from the same boot is aligned on uptime_ms directly."
    },
    "firmware_version": {
      "anyOf": [
        {
          "type": "string",
          "minLength": 1,
          "maxLength": 64
        },
        {
          "type": "null"
        }
      ]
    },
    "status": {
      "type": "object",
      "properties": {
        "camera": {
          "type": "string",
          "enum": [
            "ok",
            "error",
            "disabled",
            "unknown"
          ]
        },
        "imu": {
          "type": "string",
          "enum": [
            "ok",
            "error",
            "disabled",
            "unknown"
          ]
        },
        "speaker": {
          "type": "string",
          "enum": [
            "ok",
            "error",
            "disabled",
            "unknown"
          ]
        },
        "wifi_rssi_dbm": {
          "anyOf": [
            {
              "type": "integer",
              "minimum": -127,
              "maximum": 0
            },
            {
              "type": "null"
            }
          ]
        },
        "free_heap_bytes": {
          "anyOf": [
            {
              "type": "integer",
              "minimum": 0,
              "maximum": 9007199254740991
            },
            {
              "type": "null"
            }
          ]
        },
        "last_error": {
          "anyOf": [
            {
              "type": "string",
              "maxLength": 120,
              "pattern": "^[a-z0-9_:.-]*$"
            },
            {
              "type": "null"
            }
          ],
          "description": "Short error code, never free text or secrets."
        },
        "speaker_volume": {
          "description": "Volume the device applies now (fraction of full scale). Sent only to a server whose heartbeat response carries config.",
          "type": "number",
          "minimum": 0,
          "maximum": 1
        },
        "audio_codecs": {
          "description": "Audio codecs this firmware plays (ADR-025). Sent only to a server whose heartbeat response has config.report_audio_codecs; an MP3 command needs \"mp3\" here.",
          "minItems": 1,
          "maxItems": 4,
          "type": "array",
          "items": {
            "type": "string",
            "enum": [
              "pcm_s16le",
              "mp3"
            ]
          }
        }
      },
      "required": [
        "camera",
        "imu",
        "speaker",
        "wifi_rssi_dbm",
        "free_heap_bytes",
        "last_error"
      ],
      "additionalProperties": false
    }
  },
  "required": [
    "schema_version",
    "device_id",
    "clock",
    "firmware_version",
    "status"
  ],
  "additionalProperties": false,
  "description": "Periodic device self-report. Also refines the backend's estimate of this boot's clock."
}
