{
  "schema_version": "device-heartbeat.v2",
  "device_id": "esp32-cam-example",
  "clock": {
    "boot_id": "boot-7f3a91c2",
    "uptime_ms": 3605000,
    "wall_clock_synced": true,
    "wall_time": "2026-10-19T01:00:06.100Z"
  },
  "firmware_version": "fw-example-0.1",
  "status": {
    "camera": "ok",
    "imu": "ok",
    "speaker": "ok",
    "wifi_rssi_dbm": -61,
    "free_heap_bytes": 143000,
    "last_error": null
  }
}
